{
  "version": 2.0,
  "success": true,
  "reason": null,
  "content": {
    "success": true,
    "sdlp_incident_id": 481,
    "sdlp_incident_status": "Dismissed",
    "sdlp_incident_severity_id": "Low"
  },
  "raw": null,
  "inputs": {
    "incident_id": 3661,
    "sdlp_incident_status": "Dismissed",
    "sdlp_incident_severity_id": "Info"
  },
  "metrics": {
    "version": "1.0",
    "package": "fn-symantec-dlp",
    "package_version": "2.0.0",
    "host": "MacBook-Pro.local",
    "execution_time_ms": 15519,
    "timestamp": "2022-04-01 14:47:38"
  }
}